{
  "configuration_digest": "sha256:14beaf73530bd610e0ce452c80a2d1227d5efafd80bedee3642a81b9c85e1835",
  "fidelity": "EXACT",
  "omissions": [],
  "payload_address": "cas:sha256/aad6d0b5c27b17c7fb47aa820c8d3b8c96d13ca93946ac31b04514916b00348d",
  "payload_digest": "sha256:aad6d0b5c27b17c7fb47aa820c8d3b8c96d13ca93946ac31b04514916b00348d",
  "produced_at": "2026-08-23T20:19:24+00:00",
  "produced_by": "asset-history-driver",
  "reader_id": "soveraeign-asset-history-reader",
  "reader_version": "1",
  "recording_id": "rec-4e0e9c8fbffb1f99",
  "source_digest": "sha256:aad6d0b5c27b17c7fb47aa820c8d3b8c96d13ca93946ac31b04514916b00348d",
  "source_id": "git-commit:d9048853ea503471675271b49e1c0d0109ccdf22",
  "standing": "RECORDED"
}
