{
  "configuration_digest": "sha256:14beaf73530bd610e0ce452c80a2d1227d5efafd80bedee3642a81b9c85e1835",
  "fidelity": "EXACT",
  "omissions": [],
  "payload_address": "cas:sha256/324357d91708255831b2618d9143d29216a3336b803f12d7cbf1c717930d55ba",
  "payload_digest": "sha256:324357d91708255831b2618d9143d29216a3336b803f12d7cbf1c717930d55ba",
  "produced_at": "2026-08-23T20:19:24+00:00",
  "produced_by": "asset-history-driver",
  "reader_id": "soveraeign-asset-history-reader",
  "reader_version": "1",
  "recording_id": "rec-6eeb3d7cba3bb20c",
  "source_digest": "sha256:324357d91708255831b2618d9143d29216a3336b803f12d7cbf1c717930d55ba",
  "source_id": "git-commit:86ee4532286a590b3e62f6fc1af2985954a6b4d8",
  "standing": "RECORDED"
}
