{
  "configuration_digest": "sha256:14beaf73530bd610e0ce452c80a2d1227d5efafd80bedee3642a81b9c85e1835",
  "fidelity": "EXACT",
  "omissions": [],
  "payload_address": "cas:sha256/b9611ab1eebcd48756688cb7370670c3ef27c547f32505a59a7c8d7d8c0a23b1",
  "payload_digest": "sha256:b9611ab1eebcd48756688cb7370670c3ef27c547f32505a59a7c8d7d8c0a23b1",
  "produced_at": "2026-08-23T20:19:25+00:00",
  "produced_by": "asset-history-driver",
  "reader_id": "soveraeign-asset-history-reader",
  "reader_version": "1",
  "recording_id": "rec-b21d1a86a8bcadae",
  "source_digest": "sha256:b9611ab1eebcd48756688cb7370670c3ef27c547f32505a59a7c8d7d8c0a23b1",
  "source_id": "github-issue:45",
  "standing": "RECORDED"
}
