{
  "configuration_digest": "sha256:14beaf73530bd610e0ce452c80a2d1227d5efafd80bedee3642a81b9c85e1835",
  "fidelity": "EXACT",
  "omissions": [],
  "payload_address": "cas:sha256/6616a33105b7001b5d043ab600333cb4fbe52bb4af34dfd402d3bbd9577e21c0",
  "payload_digest": "sha256:6616a33105b7001b5d043ab600333cb4fbe52bb4af34dfd402d3bbd9577e21c0",
  "produced_at": "2026-08-23T20:19:25+00:00",
  "produced_by": "asset-history-driver",
  "reader_id": "soveraeign-asset-history-reader",
  "reader_version": "1",
  "recording_id": "rec-3a472b5a5a7b2957",
  "source_digest": "sha256:6616a33105b7001b5d043ab600333cb4fbe52bb4af34dfd402d3bbd9577e21c0",
  "source_id": "github-issue:3",
  "standing": "RECORDED"
}
