{
  "configuration_digest": "sha256:14beaf73530bd610e0ce452c80a2d1227d5efafd80bedee3642a81b9c85e1835",
  "fidelity": "EXACT",
  "omissions": [],
  "payload_address": "cas:sha256/a683625dc4a73dc8cf5eb0241d00778f3b31cc9b48ac1f4dfa4fb05c809a14a6",
  "payload_digest": "sha256:a683625dc4a73dc8cf5eb0241d00778f3b31cc9b48ac1f4dfa4fb05c809a14a6",
  "produced_at": "2026-08-23T20:19:25+00:00",
  "produced_by": "asset-history-driver",
  "reader_id": "soveraeign-asset-history-reader",
  "reader_version": "1",
  "recording_id": "rec-27b2c8a2c0b7135f",
  "source_digest": "sha256:a683625dc4a73dc8cf5eb0241d00778f3b31cc9b48ac1f4dfa4fb05c809a14a6",
  "source_id": "github-issue:11",
  "standing": "RECORDED"
}
