{
  "configuration_digest": "sha256:14beaf73530bd610e0ce452c80a2d1227d5efafd80bedee3642a81b9c85e1835",
  "fidelity": "EXACT",
  "omissions": [],
  "payload_address": "cas:sha256/6c07e5cefce87caba53f3ad97292927d1e221ea18c572762fbe16fff8b0bd91d",
  "payload_digest": "sha256:6c07e5cefce87caba53f3ad97292927d1e221ea18c572762fbe16fff8b0bd91d",
  "produced_at": "2026-08-23T20:19:24+00:00",
  "produced_by": "asset-history-driver",
  "reader_id": "soveraeign-asset-history-reader",
  "reader_version": "1",
  "recording_id": "rec-c5f0980b1df2dc03",
  "source_digest": "sha256:6c07e5cefce87caba53f3ad97292927d1e221ea18c572762fbe16fff8b0bd91d",
  "source_id": "github-pr:36",
  "standing": "RECORDED"
}
