{
  "configuration_digest": "sha256:14beaf73530bd610e0ce452c80a2d1227d5efafd80bedee3642a81b9c85e1835",
  "fidelity": "EXACT",
  "omissions": [],
  "payload_address": "cas:sha256/7f18511ce6d54a2ca9f63e743b58516f7c29c1618759d43af887a350eb99959d",
  "payload_digest": "sha256:7f18511ce6d54a2ca9f63e743b58516f7c29c1618759d43af887a350eb99959d",
  "produced_at": "2026-08-23T20:19:24+00:00",
  "produced_by": "asset-history-driver",
  "reader_id": "soveraeign-asset-history-reader",
  "reader_version": "1",
  "recording_id": "rec-ccc5667326581ed4",
  "source_digest": "sha256:7f18511ce6d54a2ca9f63e743b58516f7c29c1618759d43af887a350eb99959d",
  "source_id": "git-commit:a518afdf7c34af0953fc7f7496b04f42c1d7fc15",
  "standing": "RECORDED"
}
