{
  "configuration_digest": "sha256:14beaf73530bd610e0ce452c80a2d1227d5efafd80bedee3642a81b9c85e1835",
  "fidelity": "EXACT",
  "omissions": [],
  "payload_address": "cas:sha256/8716ed82c633aec5123f88b58ae5fe79ecdddd9e8a8c7c5b4dab4e9b38ca8f62",
  "payload_digest": "sha256:8716ed82c633aec5123f88b58ae5fe79ecdddd9e8a8c7c5b4dab4e9b38ca8f62",
  "produced_at": "2026-08-23T20:19:25+00:00",
  "produced_by": "asset-history-driver",
  "reader_id": "soveraeign-asset-history-reader",
  "reader_version": "1",
  "recording_id": "rec-bc900ca3796289e7",
  "source_digest": "sha256:8716ed82c633aec5123f88b58ae5fe79ecdddd9e8a8c7c5b4dab4e9b38ca8f62",
  "source_id": "github-issue:8",
  "standing": "RECORDED"
}
